标题,总价（万）,单价,小区,区域,房间数,大小,朝向,建造时间,标签
降价！东辉花园中心花园旁电梯三房南北通透 简装 看房 有锁,228,24897,东辉花园(台江),台江,3,91.58,南北,2005,"['南北', '满二年', '近地铁']"
房龄新 带电梯 商品住宅 临地铁 满二 朝南,187,20164,三盛国际公园贝肯郡,晋安,3,92.74,南,2015,"['南', '满二年', '近地铁']"
新到！金牛山庄，茶园山小，居家3房，南北通透，杨桥中，明卫,175,20589,金牛山庄,鼓楼,3,85,南北,1998,"['南北', '满二年', '近地铁', '绿化率高']"
毗临宝龙广场，精装50万，电梯大3房，全屋智能家居，急售可谈,275,24031,联美都市公寓,台江,3,114.44,南北,2005,"['南北', '满五年', '近地铁', '车位充足']"
金城湾 东端头 124平 3房2卫 中楼层 采光通风丫霸有锁,268,21554,新榕金城湾,仓山,3,124.34,南北,2015,"['南北', '房东直卖', '满二年', '近地铁']"
三木都市田园 3室2厅 业主自己住，满五年，无抵押,215,22594,三木都市田园1期,晋安,3,95.16,南,2004,"['南', '满五年', '近地铁']"
满二 配套齐全 中间好楼层 房龄新 环境好 小三居,228,23940,三盛国际公园剑桥区,晋安,2,95.24,南北,2015,"['南北', '满二年', '绿化率高']"
鼓楼区 隆凤新村 三房 205万,205,21399,隆凤新村,鼓楼,3,95.8,南北,1999,"['南北', '满五年', '近地铁']"
长寿园 3室2厅 精装,165,20411,义洲新区长寿园,台江,3,80.84,南北,2005,"['南北', '近地铁']"
金山万达旁，金骏小区一区，采光视野好， 楼层，诚意出售,188,22046,金骏小区一区,仓山,3,85.28,南,2008,"['南', '房东直卖', '近地铁']"
二期三房两卫，中层视野无遮挡，满两年，人车分流，精装修,179.8,20502,中海寰宇天下,闽侯,3,87.7,南,2016,"['南', '满二年', '近地铁']"
公安公寓 89平 电梯3楼 1梯2户 3房 满五,226,24836,福州公安公寓,晋安,3,91,南北,1998,"['南北', '满五年', '近地铁']"
福州 高新区 中高端社区 人车分流 中海寰宇天下 视野好 一,210,24078,中海寰宇天下,闽侯,3,87.22,南,2016,"['南', '满二年', '近地铁']"
3房2卫 精装泰禾红峪，万达商圈，地铁，拎包入住,230,21305,泰禾红峪,仓山,3,107.96,南北,2010,"['南北', '满二年', '近地铁']"
新到 东街口 地铁口 达明小 使用面积大 居家3房,269.8,32819,肃威花园,鼓楼,3,82.21,南北,1998,"['南北', '满五年', '近地铁']"
福马路紫阳地铁站后面，长福花园，居家三房才197万,197,21870,长福花园,晋安,3,90.08,南北,2000,"['南北', '满五年', '近地铁']"
灵响小区，西南北，三面采光，非常好！,328,32476,灵响小区,鼓楼,3,101,南北,1995,"['南北', '满二年', '近地铁']"
丽景天成地铁洪湾站，户型南北通透，公摊少，价钱可谈。,260,21405,丽景天成2期,仓山,4,121.47,南,2015,"['南', '房东直卖', '满二年', '近地铁']"
三盛国际公园长岛区 商品住宅 满二 南向采光好 电梯房,215,23744,三盛国际公园长岛区,晋安,2,90.55,南,2013,"['南', '满二年', '近地铁', '绿化率高']"
新出全网金山 小，金山明星，端头三房，能改四房,248,23635,金山明星,仓山,3,104.93,南北,2004,"['南北', '满五年', '近地铁']"
更.名，无费用，精装融创福州府左海望悦，中骏世界城南台十六府,217,24407,融创福州府C区,仓山,3,88.91,南北,2023,"['南北', '满二年', '近地铁', '次新房']"
大儒板块，电梯高层，居家3房，钱塘文博延安中免接送,228,24962,大儒世家朗园,鼓楼,3,91.34,南北,2010,"['南北', '满五年', '近地铁']"
看过来！东二环塔头金鸡山下4号线三角池地铁口，便宜有花园。,174,22636,蓝光玖榕台,晋安,3,76.87,南北,2019,"['南北', '满二年', '近地铁', '车位充足']"
阳光城大都会C区 3室2厅高楼层纯毛坯 近地铁,185,20495,阳光城大都会,仓山,3,90.27,南北,2018,"['南北', '满二年', '近地铁', '次新房']"
"泰禾福州院子|仙洲路88,99号3室1厅1卫95.84平方米",207,21599,泰禾福州院子,仓山,3,95.84,南北,2018,"['南北', '唯一住房', '近地铁', '次新房']"
苍霞 上下杭景区 闽江公园旁 福 板块三保园,190,23629,三保园,台江,3,80.41,南,2003,"['南', '房东直卖', '满二年', '近地铁']"
融晟红郡 商业配套齐全 商品房 刚需小三居 南北通透,205,24353,融晟红郡,仓山,3,84.18,南北,2009,"['南北', '满二年', '近地铁']"
急出丨华润橡树湾家园丨江景大两房丨190万满两年丨价格可谈哦,190,21658,华润橡树湾,仓山,2,87.73,南北,2017,"['南北', '满二年']"
划~试验小丨精装88丨仅售188w丨中楼层丨采光日照充足,188,21313,华润橡树湾,仓山,2,88.21,南北,2015,"['南北', '满二年']"
新报急售！！省图周边社区 电梯高层不是顶楼 朝南无遮挡视野开,342,34898,馨泉公寓,鼓楼,3,98,南北,2000,"['南北', '满二年', '近地铁']"
左海公园对面 花园社区 带中心花园 电梯3房 厅带阳台,249,21455,天赐良园,鼓楼,3,116.06,南北,2003,"['南北', '满五年', '车位充足']"
鼓楼铜盘 电梯高层，端头全明，双卫，南北通透，采光无遮挡,195,20968,凤仪家园,鼓楼,4,93,南北,2009,"['南北', '满二年']"
央企橡树湾丨3房户型房东急卖丨价格能大谈丨端头户型方正丨丫霸,215,24443,橡树湾橡府,仓山,3,87.96,南北,2015,"['南北', '满二年', '近地铁']"
高新区，地铁口，总价185万，中海寰宇天下，精装3房2卫,185,20655,中海寰宇天下,闽侯,3,89.57,南北,2018,"['南北', '满二年', '近地铁', '次新房']"
龙湖兰园天序 交通便捷 带电梯 小三居 次新小区 中间好楼层,209,23566,龙湖兰园天序,仓山,3,88.69,南北,2021,"['南北', '唯一住房', '近地铁', '次新房']"
地.铁口 鲁能公馆 看中心花园 百米楼距 带超大外阳台,350,30435,鲁能公馆一期,晋安,3,115,南北,2017,"['南北', '满二年', '近地铁']"
玉融花园 商品住宅 商业配套成熟 南北通透 近地铁 带电梯,288,30968,玉融花园,鼓楼,3,93,南北,1995,"['南北', '满二年', '近地铁']"
罗马假日花园所有 都有，欢迎来电了解适合您的房源,380,32355,罗马假日花园,晋安,3,117.45,南北,2003,"['南北', '满二年', '近地铁']"
三木城C1区 小三居 商品住宅 双卫生间 中间楼层,233,23827,三木城C1区,晋安,3,97.79,南,2011,"['南', '满二年', '近地铁', '车位充足']"
二环铜盘路，软件园附近，03 年商品房社区，丞相福道边上,224,25155,五凤兰庭一期,鼓楼,3,89.05,南北,2003,['南北']
精装修 金辉淮安半岛泊郡 98平 精装 电梯高层,200,20334,金辉淮安半岛泊郡,仓山,3,98.36,南北,2016,"['南北', '满二年', '车位充足']"
天空之城 精装3房 电梯高层 刷卡入户 带车位 视野,209,22718,天空之城天玺,晋安,3,92,南北,2020,"['南北', '有电梯', '次新房']"
东二环泰禾 香开新城 电梯中层 精装三房 三房朝南 总价低！,268,31214,香开新城,晋安,3,85.86,南,2014,"['南', '满二年', '近地铁']"
急售！省体中心！钱塘分校！品质社区！9年免接送！低总价,238,25586,融侨花园2区,鼓楼,3,93.02,南,1998,"['南', '房东直卖', '满二年', '近地铁']"
浦上大道，金山万达旁，正祥一品，精装修3房，人车分流，户型好,249,24647,正祥一品新筑,仓山,3,101.03,南北,2012,"['南北', '满二年', '近地铁']"
茶园新苑 医疗配套成熟 商业配套成熟 小区新 双卫格局,229,25445,茶园新苑,晋安,3,90,东南,2018,"['东南', '有电梯', '近地铁', '次新房']"
融晟红郡 刚需两居 交通便利 商圈成熟 近医院 有电梯,196,22355,融晟红郡,仓山,2,87.68,南北,2012,"['南北', '满五年', '近地铁']"
井大新村|化民后巷2号3室1厅1卫97.29平方米,350,35975,井大新村,鼓楼,3,97.29,南,2000,"['南', 'VIP房东直卖', '近地铁']"
龙湖兰园天序商品房丨通透三房户型,199.9,23028,龙湖兰园天序,仓山,3,86.81,南北,2020,"['南北', '唯一住房', '近地铁', '次新房']"
地铁口，世欧彼岸城c区，金闽小金山在，电梯中层三房，榕心映月,308,33910,世欧彼岸城C区,仓山,3,90.83,南,2009,"['南', '满五年', '近地铁', '车位充足']"
南北通透 满五 冬馨苑 精装修 采光好 周边商圈成熟,178,22250,冬馨苑,仓山,3,80,南北,2005,"['南北', '满五年', '近地铁']"
中茵上城国际 3室2厅 南北通透 精装3房,178,20018,中茵上城国际,仓山,3,88.92,东南,2011,"['东南', '有电梯', '近地铁']"
西洪路，湖滨，十八，电梯3房2卫，南北通透，免接送，一梯两户,330,34375,西洪小区,鼓楼,3,96,南北,1998,"['南北', '满二年', '近地铁']"
丞相坊小区 小三房 高楼层视野无遮挡 满五 近医院 西南朝向,220,24642,丞相坊小区,鼓楼,3,89.28,西南,2010,"['西南', '满五年']"
杨桥路陆庄地铁口背后，2015年小区，东南朝向，客厅带阳台,315,33158,杨桥新苑,鼓楼,3,95,南,2015,"['南', '满二年', '近地铁']"
东泰禾 保利香槟国际 标准二房 电梯高层 精装修 户型好,228,33723,保利香槟国际,晋安,2,67.61,南,2016,"['南', '唯一住房', '近地铁']"
旁 电梯复式 端头全明采光好 近上藤地铁站,195,21196,临江新天地琼花苑,仓山,3,92,东南,2010,"['东南', '满二年', '近地铁']"
新出，2号线紫阳D铁口，私人大露台，电梯精装3房。随时看房！,217,22422,福马名城A座,晋安,3,96.78,东北,2006,"['东北', '满五年', '近地铁', '车位充足']"
双标准卫生间，2梯3户，纯商品房社区地铁口出行方便,240,24423,三木城C2区,晋安,3,98.27,南,2010,"['南', '满二年', '近地铁']"
江南水都名筑，居家三房，南北通透,308,33119,融侨江南水都名筑,仓山,3,93,南北,2005,"['南北', '满五年', '近地铁']"
罗汉山地铁，新盘商品房，金岚秀山电梯中层端头全明,188,21117,新榕金岚秀山,晋安,3,89.03,南,2022,"['南', '有电梯', '近地铁', '次新房']"
惊讶！房东置换急售！出门紫阳站，标准三房！ 楼层，低总价,210,20452,福临东城,晋安,3,102.68,南北,2005,"['南北', '满二年', '近地铁']"
降价，可谈，中庚国际华府洪湾路金山公园旁，电梯高层品质三房！,305,32895,中庚国际华府,仓山,3,92.72,南北,2007,"['南北', '有电梯', '近地铁']"
浦上大道融信大卫城A区！ 拎包入住啊，抓紧,225,24987,融信大卫城A区,仓山,3,90.05,南北,2013,"['南北', '满二年', '近地铁']"
市中心 精装修 3房单位宿舍 南北通透 价格实惠,180,20070,福州市石油公司及洪山机关宿舍,鼓楼,3,89.69,西南,1995,"['西南', '满五年', '近地铁']"
五四北泰禾 地铁口 电梯高层 可拎包入住,210,22429,三木城C2区,晋安,2,93.63,南北,2011,"['南北', '满二年', '近地铁']"
仓山万达附近！单本证低总价大三房，急售！南北通透，端头户型,238,22650,泰禾红峪,仓山,3,105.08,南北,2013,"['南北', '满五年', '近地铁']"
茶亭公园旁 国货小福 电梯6楼 端头大三房 采光好急售！,255,21734,广安城,台江,3,117.33,南北,2000,"['南北', '满二年', '近地铁']"
三盛国际公园 花园式社区 不沿街不靠桥 大阳台,210,21875,三盛国际公园剑桥区,晋安,2,96,南北,2015,"['南北', '满二年', '绿化率高']"
左海梅峰，罗马生态园，楼梯，精装三房，全明户型，房东换房出售,168,20488,罗马生态园,鼓楼,3,82,南北,2004,"['南北', '满五年', '近地铁', '多人关注']"
框架三房 华侨小 古田支路 水部站 楼层适中 玉融边,220,23707,党校宿舍,鼓楼,3,92.8,南北,1998,"['南北', '满五年', '近地铁']"
鼓实屏东中，框架3房，总价355万，北江新村中行宿舍，中层！,355,35859,北江新村,鼓楼,3,99,南北,2000,"['南北', '满五年', '近地铁']"
金闽小， 接送，房东急售，出价就卖,222,22200,金闽小区二区东区,仓山,3,100,南北,2015,"['南北', '满二年', '近地铁']"
金闽小 金山中 金闽小区 精装 全明户型,225,24658,金闽小区三区B区,仓山,3,91.25,南,2008,"['南', '满二年', '近地铁']"
整个屏北分校低总价三房，精装修直接拎包入住楼上有小储藏室,189,20770,琴亭花园,鼓楼,3,91,南北,1997,"['南北', '房东直卖', '满五年', '近地铁']"
西湖边电梯3房 一梯两户南北通透 西峰晓十八 另送附属间,278,33096,通湖新村,鼓楼,3,84,南北,1998,"['南北', '满二年', '近地铁']"
哦！浦上大道多层[17层]225.00万元毛坯,214,24059,龙湖兰园天序,仓山,3,88.95,南北,2022,"['南北', '有电梯', '近地铁', '次新房']"
秋爽苑 满五 南北通透 出行方便 板楼 小三居,193,21312,秋爽苑,仓山,3,90.56,南北,2006,"['南北', '满五年', '近地铁']"
近地铁 中间楼层采光好 购物方便 满二 配套齐全 东南户型,173,20532,枫丹白鹭一至二期,晋安,3,84.26,东南,2006,"['东南', '满二年', '近地铁']"
特别划算！奥体中心，华威旁（30万现代精装）电梯高层三房,200,21942,奥体公馆,仓山,3,91.15,东南,2016,"['东南', '满五年', '近地铁']"
北尚B区 刚需小三居 带电梯 西南户型 中间楼层采光好,210,20226,北尚B区,晋安,3,103.83,西南,2008,"['西南', '满二年', '近地铁', '车位充足']"
三盛长岛区 排看公园 绿化高空气好 拎包住大阳台,225,24688,三盛国际公园长岛区,晋安,2,91.14,南,2013,"['南', '满二年', '近地铁', '绿化率高']"
滨海橙里 3房2厅2卫2阳台，精装修，自住，看房约,162,20238,滨海橙里,仓山,3,80.05,东南,1917,"['东南', '满二年', '近地铁']"
金辉天鹅湾东端头三房两卫 户型,239,23638,金辉天鹅湾,仓山,3,101.11,东南,2008,"['东南', '满五年', '近地铁', '绿化率高']"
纯毛坯 融信 高层看江 安静不吵 3房2卫 无抵押,259,23630,融信白宫,仓山,3,109.61,西南,2015,"['西南', '满二年', '近地铁']"
五凤兰庭商品房，东端头，东南北三面采光，一梯两户，中间楼层,235,21732,五凤兰庭三期,鼓楼,3,108.14,南北,2004,"['南北', '满二年', '车位充足']"
交通路白马南路宝龙城市广场书香大第旁福机新苑玖禧雅筑博美诗邦,189,20774,上海新苑,台江,3,90.98,南北,2014,"['南北', '满五年', '近地铁']"
世欧王庄四区 3室2厅2卫 电梯高层 好户型 房东诚意出售,215,23627,世欧王庄四区,晋安,3,91,西南,2014,"['西南', '满二年', '近地铁']"
一步三附小，金山桔园一期龙苑C区，朝南大三房,285,24153,金山桔园龙苑(C区),仓山,3,118,东南,2006,"['东南', '满五年', '近地铁']"
橘 万科品质 融信 城低总价3房仅售179万，无欠款,179,20052,融信第一城,仓山,3,89.27,南北,2008,"['南北', '满五年', '近地铁', '绿化率高']"
五一广场 华侨小 精装修 框架三房 福新西路 楼层好 近,205,23564,水涧新村(1-7座),鼓楼,3,87,南北,1998,"['南北', '满五年', '近地铁']"
泰禾旁 楼下就是地铁 精装3房 电梯高层 拎包即住,208,19943,君临香格里C区,晋安,3,104.3,南,2014,"['南', '房东直卖', '满五年', '近地铁']"
白湖亭万达旁 南二环 双阳台毛坯现房 全明户型,180,21177,建总领筑,仓山,3,85,南北,2020,"['南北', '近地铁', '车位充足']"
高新区 地铁口 自带商圈 中海寰宇天下 看江,200,22989,中海寰宇天下,闽侯,3,87,南,2016,"['南', '满二年', '近地铁']"
温泉小， ，框架大3房，永安新村，中楼层，采光好，有钥匙,308,34337,永安新村,鼓楼,3,89.7,南北,1998,"['南北', '满五年', '近地铁']"
商品房 购物方便 交通便捷 南北通透 双卫格局 医疗配套成熟,346,31744,灵响小区,鼓楼,3,109,南北,2007,"['南北', '满二年', '近地铁']"
省人民医院，东辉花园，花园社区 南北通透三房，八一七国货路,200,23256,东辉花园(台江),台江,3,86,南北,2002,"['南北', '满二年', '近地铁']"
工业路茶亭地铁口纯商品房东辉花园3房居家装修215万,215,25000,东辉花园(台江),台江,3,86,南北,2000,"['南北', '满五年', '近地铁']"
永同昌公寓 近医院 满五 购物方便 产权清晰 交通便捷,236,24584,永同昌公寓,鼓楼,3,96,西,1998,"['西', '满五年', '近地铁']"
东泰禾，保利香槟。精装3房，电梯高层，采光视野好！,275,30775,保利香槟国际,晋安,3,89.36,南北,2018,"['南北', '满二年', '近地铁', '次新房']"
鼓楼西二环 福屿三区 黎明交易所旁 02年商品房 三房两卫,188,21292,福屿小区三区,鼓楼,3,88.3,南北,2002,"['南北', '近地铁']"
斗门地铁口18年社区精装30万，高层3房，南北通透茶园新苑。,209,23223,茶园新苑,晋安,3,90,东南,2015,"['东南', '满二年', '近地铁']"
华林路斗门地铁口 11年社区电梯大三房 采光好,235,22743,华林上景,晋安,3,103.33,西南,2012,"['西南', '满二年', '近地铁']"
浦上大道金山公园旁金辉天鹅湾 精装两房,185,23600,金辉天鹅湾,仓山,2,78.39,南,2010,"['南', '满二年', '近地铁', '绿化率高']"
悦榕公馆真实包车位！仓山万达，精装3房2卫，地铁浦上大道站,295,33364,杉林悦榕公馆,仓山,3,88.42,南北,2016,"['南北', '满二年', '近地铁', '多人关注']"
大利嘉城南公园旁贴砖社区，电梯大三房，一梯两户南北通透。,248,22717,汇福花园,台江,3,109.17,南北,2003,"['南北', '满五年', '近地铁']"
台江 白马路 乃裳园 电梯三房 精装修 端头户型 南北通透,240,21151,乃裳园(北区),台江,3,113.47,南北,2005,"['南北', 'VIP房东直卖', '满二年', '近地铁']"
斗门地铁口边。电梯单位宿舍管理。公安公寓。端头户型,249,22036,福州公安公寓,晋安,3,113,西南,2004,"['西南', '唯一住房', '近地铁']"
房东上门委托中海寰宇天下3室拎包入住紧邻地铁口大学城金山,201,22479,中海寰宇天下,闽侯,3,89.42,南北,2016,"['南北', '房东直卖', '满二年', '近地铁']"
价格可谈！茶园山杨桥！贴砖社区！框架三房！ 东南全明户型,240,25000,大王里西洪新村,鼓楼,3,96,东南,2004,"['东南', '满五年', '近地铁']"
竹林境新村 3室2厅 南北通透户型好,250,35715,竹林境新村,鼓楼,3,70,南北,1992,"['南北', '满二年', '近地铁']"
新！五四路省体百合苑全新精装电梯三房总价低户型方正拎包入住,199,23976,省体百合苑,鼓楼,3,83,南北,2003,"['南北', '满二年', '近地铁']"
鼓楼2022年保利天悦！左海公园对面！电梯2房！视野无遮挡,216,35463,保利天悦颐海花园,鼓楼,2,60.91,南北,2022,"['南北', '满五年', '近地铁', '车位充足']"
旁 蓝光里 3室2厅 纯毛坯 看房方便,198,22000,蓝光里,晋安,3,90,南,2022,"['南', '唯一住房', '近地铁', '次新房']"
丽景天成2期88.13平178万2室2厅,178,20198,丽景天成2期,仓山,2,88.13,南北,2008,"['南北', '满五年', '近地铁']"
地铁口 阳光城新界 毛坯大4房 东头 满5,278,23600,阳光城新界,仓山,4,117.8,东南,2013,"['东南', '满二年', '近地铁']"
急！茶亭国货福8 广安城 刚需三房 临地铁 满五 带电梯,210,22013,广安城,台江,3,95.4,南北,2001,"['南北', '满五年', '近地铁']"
世欧广场 王庄四区 高楼层南北通透,215,23889,世欧王庄四区,晋安,3,90,南北,2014,"['南北', '满二年', '近地铁']"
世欧商圈 紫阳地铁口 14年电梯三房 视野好,223,24776,世欧王庄一区,晋安,3,90.01,西南,2015,"['西南', '满二年', '近地铁']"
配套成熟！核心地段二环内！现房 即装修！专车接送看实地团购,183,23764,蓝光玖榕台,晋安,3,77.01,南,2021,"['南', '满二年', '近地铁', '车位充足']"
金山南江滨，西山公园，洪塘双地铁口，融侨微豪宅，电梯高层3房,215,24671,融侨悦江南,仓山,3,87.15,东南,2015,"['东南', '满二年', '近地铁']"
地铁口 融侨悦江南 电梯中层，三房2卫 融侨新社区环境优美,228.8,24016,融侨悦江南,仓山,3,95.27,南北,2015,"['南北', '近地铁']"
中庚品质 花园式社区 近地铁 公摊小 低总价,315,32111,中庚城一期,仓山,3,98.1,南北,2011,"['南北', '满二年', '近地铁']"
金闽小，金山中，品质社区！东端头！95平310万,310,32427,中庚城一期,仓山,3,95.6,南北,2008,"['南北', '满二年', '近地铁']"
中海寰宇天下 精装修三房 可拎包入住 满两年,190,21334,中海寰宇天下,闽侯,3,89.06,南,2016,"['南', '满二年', '近地铁']"
晋安区 电建二公司南苑 三房 196万,196,23059,电建二公司南院生活区,晋安,3,85,南北,1999,"['南北', '满二年', '近地铁']"
三盛国际公园香槟公馆 有电梯 配套齐全 满二 南北通透,210,22501,三盛国际公园香槟公馆,晋安,2,93.33,南北,2015,"['南北', '房东直卖', '满二年', '近地铁']"
三盛国际公园贝肯郡 满二 带电梯 精装好房 房龄新,199,21433,三盛国际公园贝肯郡,晋安,3,92.85,南北,2015,"['南北', '满二年', '近地铁']"
三木城C2区 电梯房 双卫格局 近地铁 南北通透 满二,228,23218,三木城C2区,晋安,3,98.2,南北,2010,"['南北', '满二年', '近地铁']"
保利香槟国际 带大露台 四号线地铁口 东泰禾对面 ！,240,26792,保利香槟国际,晋安,3,89.58,南,2013,"['南', '满二年', '近地铁']"
全新现代精装3房 电梯高层 俯瞰维多利亚公园 拎包即住,330,24640,三盛国际公园长岛区,晋安,3,133.93,南北,2013,"['南北', '满二年', '近地铁', '绿化率高']"
急售！紫阳地铁口 世欧王庄 大名城旁电梯高层精装3房 采光好,239,21511,福马名城A座,晋安,3,111.11,南北,2004,"['南北', '满五年', '近地铁', '车位充足']"
文化宫旁 金安公寓 满五 免个税 外扩15平 电梯三房,198,20651,金安公寓,台江,3,95.88,东南,1998,"['东南', '满五年', '近地铁']"
配套齐全 近地铁 带电梯 小三房 购物方便 商品住宅,192,21530,永翌上尚城,仓山,3,89.18,南北,2014,"['南北', '满二年', '近地铁']"
采光丫霸 世欧广场对面 业主自住装修 保持很好,199,22112,世欧王庄四区,晋安,3,90,南北,2014,"['南北', '满二年', '近地铁']"
鼓楼区乌山路， 7万，电梯大三房朝南无遮挡，拎包住,225,24194,凤湖新城二区,鼓楼,3,93,南北,2013,"['南北', '满二年', '近地铁', '车位充足']"
纯商品房，花园社区，绿城柳岸晓峰，电梯高层，精装3房2卫,196,20087,绿城柳岸晓风,晋安,3,97.58,南北,2023,"['南北', '房东直卖', '有电梯', '次新房']"
新到中山小， ，框架3房，外墙改造，七星井新村，中山大院,308,32422,七星井新村,鼓楼,3,95,南北,2000,"['南北', '满五年', '近地铁']"
商圈成熟 近地铁 近医院 刚需小三居 高楼层采光充足,218,24592,正荣府,晋安,3,88.65,南,2020,"['南', '有电梯', '次新房']"
阳光城檀悦 出行方便 西南户型 次新房 精装好房 得房率高,246,23248,阳光城檀悦,晋安,3,105.82,西南,2019,"['西南', '房东直卖', '满二年', '近地铁']"
万达拎包入住 浦上大道 红郡 三房精装修,215,23860,融晟红郡,仓山,3,90.11,南北,2009,"['南北', '满二年', '近地铁']"
坐等拆迁，河南新村，上靠可拿105户型，非常划算，先到先得,210,23334,河南新村,鼓楼,3,90,南北,1988,"['南北', '满五年', '近地铁']"
06年贴砖社区 双地铁口 原装电梯低单价 南北通透双阳台,249,21653,明阳东都,晋安,3,115,南北,2006,"['南北', '满二年', '近地铁']"
海潮小区|海潮路50号3室1厅1卫94.88平方米,208,21923,海潮小区,鼓楼,3,94.88,南北,2000,"['南北', 'VIP房东直卖', '近地铁']"
新出金辉枫尚3房2卫，高楼层，端头户型仓山万达爱琴海浦上大道,210,22218,金辉枫尚,仓山,3,94.52,南北,2010,"['南北', '满五年', '近地铁']"
三盛国际公园上东区 产权清晰 密度低 配套齐全 楼层好,215,23650,三盛国际公园上东区,晋安,2,90.91,南,2014,"['南', '满二年', '近地铁']"
五四北次新房，保利天玺，电梯入户，精装3房2卫。全明电梯高层,205,22044,天空之城天玺,晋安,3,93,南北,2020,"['南北', '满二年', '次新房']"
新报急售！！温泉小框架三房 省图周边 朝南视野无遮挡 闹中取,345,38334,金汤花园,鼓楼,3,90,南北,1994,"['南北', '满二年', '近地铁']"
近地铁 交通便捷 得房好 满二 南北通透 配套齐全,338,30082,鲁能公馆一期,晋安,3,112.36,南北,2017,"['南北', '满二年', '近地铁']"
东二环泰禾，岳峰新城，东端头，电梯高层，全明户型，看房方便,215,23889,岳峰新城一区,晋安,3,90,南北,2016,"['南北', '满五年', '近地铁']"
总价嘴低3房208.6万，目前业主自己住，满2年，有解压,208.6,23282,中海寰宇天下,闽侯,3,89.6,南,2016,"['南', '房东直卖', '满二年', '近地铁']"
医疗配套成熟 交通便捷 带电梯 商品住宅 满五 购物方便,348,35877,衣锦华庭,鼓楼,2,97,东,2012,"['东', '满五年', '近地铁']"
2019年次新房，毛坯复式楼，套内120平，2梯4户，诚售！,268,31080,世茂璀璨天城(一期),晋安,3,86.23,南,2019,"['南', '满二年', '近地铁', '车位充足']"
近距离铜盘小，免接，框架大三房，超大客厅，一梯两户中间楼层,215,22209,金海公寓,鼓楼,3,96.81,南北,2000,"['南北', '满五年']"
