标题,总价（万）,单价,小区,区域,房间数,大小,朝向,建造时间,标签
中庚城一期 端头三房朝南 带入户花园 拎包入住 次顶楼采光好,330,33472,中庚城一期,仓山,3,98.59,南,2012,"['南', '热门小区', '近地铁', '随时可看']"
世欧王庄一区 2室1厅 朝南象园小，小区物业好，环境优美，,129,21500,世欧王庄一区,晋安,2,60,南,2013,"['南', '热门小区', '南北通透', '房东急售']"
来电有优惠，送50平花园，三叉街一号线地铁，全新装修三房,232,24117,中骏世界城璟悦,仓山,3,96.2,南北,2021,"['热门小区', '南北通透', '配套成熟']"
降价50万 挥泪 保利香槟三期复式 四房 泰禾地铁站,339,28428,保利香槟国际,晋安,4,119.25,南,2019,"['南', '热门小区', '价格优惠', '房东急售']"
鼓楼区 金龙新村 三房 315万,315,35877,金龙新村,鼓楼,3,87.8,南北,1997,"['南北', '价格优惠', '房东急售', '随时可看']"
金山四房 改善社区 四号线地铁口 实用111平 专车接送,345,28992,万科城市之光,仓山,4,119,南,,"['大户型', '低容积']"
低总价两房 小区配套齐全 交通出行便利 社区环境好,128,20689,井源居,晋安,2,61.87,南,2005,"['南', '满二年', '近地铁']"
鲁能公馆一期 朝南 电梯房 正规商品房 满二 小区新,220,25169,鲁能公馆一期,晋安,2,87.41,南,2017,"['南', '热门小区', '南北通透', '房东急售']"
新出，金城湾精装修，不沿街，送入户花园南北通透刚需好房。,289,24026,新榕金城湾,仓山,3,120.29,东南,2015,"['东南', '有电梯', '近地铁']"
东泰禾 保利香槟国际 电梯高层 精装修 端头三房两卫满二,358,31150,保利香槟国际,晋安,3,114.93,东南,2016,"['东南', '满二年', '近地铁']"
金山，地铁口，万科品质。精装修。总价230万起。,395,29925,万科城市之光,仓山,4,132,南,,"['大户型', '低容积']"
地铁口 保利香槟 高层 售价267万 满二 视野无遮挡,260,29025,保利香槟国际,晋安,3,89.58,南北,2016,"['南北', 'VIP房东直卖', '满二年', '近地铁']"
铜盘小近左海公园2023年全新精装通透3房，中层，满2年省税,199,26351,兰庭六期,鼓楼,3,75.52,西南,2004,"['西南', '南北通透', '公摊小', '价格优惠']"
新出！全新精装45万，高层端头，大三房，现代轻奢风，拎包入住,205,18267,名城珑域,马尾,3,112.23,南北,2018,"['南北', '有电梯', '次新房']"
团购特价，五里亭核心，家楼下就是地铁口，国企品质，精装交付,399,31172,保利招商和樾风华,晋安,4,128,南,,"['大户型', '轨交房', '车位充足']"
泰禾广场旁，三盛精装复式，四房双阳台，设计漂亮，拎包入住，,300,24359,三盛中央公园西区,晋安,4,123.16,南北,2015,"['近地铁', '南北通透', '随时可看']"
诚意出，鲁能一期地铁口，带二次软装20万边头全明户型，阳光足,310,27898,鲁能公馆一期,晋安,3,111.12,南北,2017,"['热门小区', '南北通透', '房东急售']"
东二环泰禾旁，5米复式楼，一层两用，得房率高，带外阳台,78.9,18548,首开中庚香开连天(商住楼),晋安,2,42.54,南北,2020,"['南北', '热门小区', '近地铁', '配套成熟']"
仓山芯 白湖亭万达边 国企精装 好房 股 看了都喜欢,249,27978,左海望悦,仓山,3,89,南,,"['南北通透', '轨交房', '车位充足']"
金城湾精装两房， ，性价比超高,170,18698,新榕金城湾,仓山,2,90.92,东南,2015,"['东南', '满二年', '近地铁', '多人关注']"
钥匙在手 鲁能公馆 地铁口 一手未入住 价格可撩 次新社区,220,25169,鲁能公馆一期,晋安,2,87.41,南北,2019,"['南北', '满二年', '近地铁', '次新房']"
万科品质现房丨精装修复式两房丨带独立阳台丨双地铁口丨 即住,57,12495,万科云城,仓山,2,45.62,南北,2018,"['南北', '热门小区', '近地铁', '价格优惠']"
晋安区 罗马假日花园 三房 375万,375,31780,罗马假日花园,晋安,3,118,南北,2003,"['南北', '满二年', '近地铁']"
五四路刚需新盘，省体边，地铁旁低总价，毛坯交房,248,27866,建总誉璟,鼓楼,3,89,南,,"['南北通透', '轨交房']"
万达商圈 霞镜新城三区 3室2厅,169,21125,霞镜新城三区,仓山,3,80,南,2021,"['南', '近地铁', '次新房']"
华林路，接送屏东中，产权清晰无纠纷，屏东城，业主急售，阳光足,270,29944,屏东城,鼓楼,3,90.17,东南,2012,"['东南', '满二年', '近地铁', '多人关注']"
瀛洲花园单价8000 精装 高层 诚意出售,75,8334,瀛洲花园,闽侯,3,90,南北,2015,"['南北', '热门小区', '价格优惠', '随时可看']"
央企打造，商业配套成熟，交通便利，,342,30536,保利云上,晋安,4,112,南,,"['大户型', '轨交房']"
房东亏本出售 淮安地铁旁 精装3房 配套成熟,179,20434,保利西江林语,仓山,3,87.6,南北,2016,"['南北', '满二年', '近地铁']"
中海观澜府 有电梯 双卫格局 95平 仅售170万,170,17871,中海观澜府,闽侯,3,95.13,南北,2020,"['南北', '近地铁', '配套成熟', '优势户型']"
喜欢在家自由轰趴的赶紧看过来 精装三房两卫108万,108,11740,黄山新城二区,仓山,3,92,南北,2018,"['南北', '有电梯', '近地铁', '车位充足']"
房东出国忍痛割爱 精装修大四房 端头全江景视野 红树林,335,18267,泰禾红树林(1期),仓山,4,183.4,南北,2012,"['南北', '满二年', '车位充足', '多人关注']"
四号线地铁口改善住宅带精装修,300,30000,中海晋安湖叁号院,晋安,3,100,南,,"['南北通透', '厨卫全明', '双卫生间', '轨交房']"
业主急售！价格优惠！地铁口，国企品质，精装3房，五四北新店,275,24475,鲁能公馆一期,晋安,3,112.36,南北,2020,"['南北', '近地铁', '新上小区', '优势户型']"
鸿裕温泉花园 近地铁 有电梯 满五 板楼 商业配套齐全,320,28572,鸿裕温泉花园,鼓楼,3,112,南北,2003,"['南北', '唯一住房', '近地铁']"
新出江景好房 江景堪比外滩 淮安半岛泊宫 毛坯三房 电梯高层,219,21532,金辉淮安国际住区泊宫,仓山,3,101.71,南北,2016,"['南北', '满二年']"
二环内准现房，户型方正，社区丫霸,341,32477,大东海晋棠府,晋安,4,105,南,,"['南北通透', '厨卫全明', '双卫生间', '轨交房']"
省直湖前二期 居家三房两卫 停车方便 板状户型 南北通透,235,22367,省直机关湖前住宅区,鼓楼,3,105.07,南北,1998,"['南北', '满五年']"
新出 高院背后 天赐良园 刚需2房 厅带阳台 南北通透,210,21887,天赐良园,鼓楼,2,95.95,南北,2003,"['南北', '满五年', '车位充足']"
2房精装，上藤地铁，贴砖社区，南北通透，装修过硬,108,21302,下池小区,仓山,2,50.7,南北,2004,"['南北', '满五年', '近地铁']"
东区，建发纯商品房，中秋国庆特价400，一梯一户大四房,480,32215,建发美的君兰和鸣,晋安,4,149,南,,"['南北通透', '厨卫全明', '双卫生间', '轨交房']"
台江光明港公园，夜市一条街，珠宝城，端头户型精装三房楼层好,137.9,18636,港务局宿舍,台江,3,74,南北,1998,"['南北', '满五年', '近地铁', '多人关注']"
急售！央企橡树湾大两房！装修25！仅185万！可以拎包入住,180,20259,华润橡树湾,仓山,2,88.85,南北,2014,"['南北', '热门小区', '价格优惠', '房东急售']"
金辉天鹅湾 4室2厅 毛坯 东端头163户型,435,26575,金辉天鹅湾,仓山,4,163.69,东南,2012,"['东南', '热门小区', '价格优惠', '随时可看']"
东部办公区，采光充足，伯恩物业，贴心，纯商品房，入户花园,278,30807,祥浦苑,仓山,3,90.24,南,2016,"['南', '有电梯', '近地铁']"
"东泰禾 晋安湖 五里亭,地铁口,0距离，纯商品 楼盘，户型好",400,31008,大东海玺悦,晋安,4,129,南,,"['南北通透', '双卫生间', '大户型', '轨交房']"
东泰禾保利香槟国际 前排视野无遮 法式精装80平 居家,248,31188,保利香槟国际,晋安,3,79.52,南,2016,"['南', '热门小区', '配套成熟', '房东急售']"
长乐大名城 刚需小三居 装修好 进修 附小 诚意出售,162,15945,长乐大名城,长乐,3,101.6,南北,2017,"['南北', '满二年', '多人关注']"
急售 99万买大三房 新社区电梯中层全明户型随时看房,99,11000,螺洲新城(三区),仓山,3,90,南北,2018,"['南北', '满二年', '近地铁', '次新房']"
鼓楼北 泰禾旁 精装修 新房，南北通透电梯高层 即住,255,23612,绿城柳岸晓风(新房),晋安,4,108,南,,['车位充足']
金山明星 配套齐全 交通便捷 近医院 产权清晰 居住密度低,268,21995,金山明星,仓山,4,121.85,南北,2003,"['南北', '满二年', '近地铁']"
正荣御湖湾 137平 每平11700元 电梯四房 满二。,170,12516,正荣御湖湾,平潭,4,135.83,南北,2019,"['南北', '热门小区', '配套成熟', '房东急售']"
鼓楼区 福大怡园 二房 158万,158,22836,怡园,鼓楼,2,69.19,南北,1990,"['南北', '热门小区', '价格优惠', '随时可看']"
泰禾红誉二期 精装修4房拎包入住 近进修 进修小,300,23256,泰禾红誉二期,长乐,4,129,南北,2017,"['南北', '热门小区', '配套成熟', '价格优惠']"
东泰禾 纯商团购2.6w 精装 联发君樾府 自带超大公园,286,29485,联发臻榕府,晋安,3,97,南,,['低容积']
金城湾，2015次新房，电梯高层端头三房，满2年！,269,21619,新榕金城湾,仓山,3,124.43,南北,2015,"['南北', '近地铁', '多人关注']"
金山小 金山地铁口 榕心映月 3室2厅,300,30986,榕心映月,仓山,3,96.82,东南,2022,"['东南', '有电梯', '近地铁', '车位充足']"
总价237万，鼓西路西湖板块，电梯框架2大房，旧米仓新村,237,29625,旧米仓新村,鼓楼,2,80,南北,1999,"['南北', '热门小区', '近地铁', '随时可看']"
阳光城象屿登云湖 洋房 叠拼 联排 市区低密度墅区 花园露台,262,19125,阳光城象屿登云湖(新房),晋安,4,137,南,,"['大阳台', '主卧套房', '动静分离', '低容积']"
书香大第 企业力荐好房诚意出售,385,31301,中庚书香大第北区,台江,3,123,南北,2008,"['热门小区', '近地铁', '南北通透']"
改善户型很不错，赠送大入户，电梯中高层，精装保持基本全新！,248,18647,三盛国际公园剑桥区,晋安,3,133,南北,2015,"['南北', '满二年', '绿化率高']"
时代美景.电梯中高层.三房居家装修.满五年. .诚意出售,175,21016,时代美景,晋安,3,83.27,南北,2004,"['南北', '满五年', '近地铁']"
国庆钜惠！255万的有天有地叠拼别墅 龙湖 之作,380,30400,龙湖云峰原著(新房),晋安,3,125,南,,['车位充足']
鲁能公馆一期 豪华精装 房龄新 南北通透 交通便捷 近地铁,210,26725,鲁能公馆一期,晋安,2,78.58,南北,2018,"['南北', '热门小区', '价格优惠', '房东急售']"
鼓楼左海屏西，电梯高层，拎包住，精装三房，南北通透视野好,218,24033,凤仪家园,鼓楼,3,90.71,南北,2010,"['南北', '满五年', '人气热搜']"
小白买房关心，但想不通的4个问题,45,7309,中房佳园,闽侯,2,61.57,南北,2015,"['南北', '近地铁', '配套成熟']"
斗门地铁口旁。单位管理宿舍 。3房 低总价,168,17856,中国银行宿舍,鼓楼,3,94.09,南北,1998,"['南北', '满五年', '近地铁']"
五里亭地铁口 国企现房首开香悦 标准三房两卫 好楼层大阳台,245,27529,首开香悦,晋安,3,89,南,,"['双卫生间', '动静分离', '户型方正', '轨交房']"
融信 B区 高层看江不吵，边套三房两厅两卫，精装60多万。,278,23837,融信白宫,仓山,3,116.63,南,2017,"['南', '有电梯', '近地铁']"
鼓楼湖前18年楼盘，电梯精装三房两卫，全明端头户型，大井佳园,215,27596,大井佳园,鼓楼,3,77.91,南北,2020,"['南北', '满二年', '车位充足', '多人关注']"
华林路火车站茶园电建二公司三房,155,19375,电建二公司南院生活区,晋安,3,80,南北,2002,"['南北', '近地铁']"
独梯独户 O公摊 醉美中式园林景观社区 现房 单价2.1左右,312,24187,首开国仕府(新房),仓山,4,129,南,,"['南北通透', '大户型', '轨交房', '车位充足']"
金闽小金山中，中庚城三期电梯高层精装四房，万达商圈视野无遮挡,410,31301,中庚城三期上峰,仓山,4,130.99,南北,2012,"['南北', '热门小区', '配套成熟', '价格优惠']"
长乐名城紫金轩 商品住宅 电梯房 南北通透 刚需小三居,170,16191,长乐名城紫金轩,长乐,3,105,南北,2019,"['南北', '配套成熟', '价格优惠', '房东急售']"
永荣拉菲郡二区 双卫生间 临地铁 出行方便 满五,309,22231,永荣拉菲郡二区,长乐,5,139,南北,2017,"['南北', '热门小区', '优势户型', '随时可看']"
北尚A区丨新出好房丨单价1.5万丨全明户型丨南北双阳台丨,160,15239,北尚A区,晋安,3,105,南北,2008,"['南北', '满二年', '近地铁']"
麦顶小 梁厝站地铁口 高得房率 央企品质社区 南江滨公园旁边,255,28978,中交中梁星海天宸(新房),仓山,3,88,南,,"['南北通透', '厨卫全明', '主卧套房', '多轨交']"
旭辉电梯叠墅丨亏本50w丨不看庙丨独梯独户丨诚意出售丨随时看,330,23271,旭辉江山云出,仓山,4,141.81,南北,2023,"['南北', '满二年', '车位充足', '人气热搜']"
金辉观澜云著 3室2厅南北通透 全明户型 大面宽短进深！！！,188,21065,金辉观澜云著(仓山),仓山,3,89.25,南,2021,"['南', '有电梯', '近地铁', '次新房']"
紫金九号，高层复式楼，原值亏本出售,315,28502,大名城紫金九号,仓山,4,110.52,南北,2023,"['南北', '有电梯', '近地铁', '车位充足']"
联排别墅6层使用，面积600平，下沉式庭院，目前399万！！,490,20000,樾榕湾,闽侯,5,245,南,,"['大户型', '低容积']"
新出！上渡次新热门好房！楼龄新 电梯高层！业主诚意出售！！！,163,21734,上渡新苑三区,仓山,2,75,南北,2022,"['热门小区', '新上小区', '南北通透']"
苍霞新城嘉盛苑精装3室2厅,160,21243,苍霞新城嘉盛苑,台江,3,75.32,南北,2001,"['南北', '配套成熟', '价格优惠', '房东急售']"
急售可谈.次新社区.电梯高层.格局明朗.户型方正刚需3房,148,18975,世茂云境,仓山,3,78,南,2021,"['南', '有电梯', '近地铁', '次新房']"
国贸三期，准现房，单价13999元起， 成,220,18966,国贸学原三期,闽侯,4,116,南,,"['双卫生间', '大户型']"
三盛国际公园贝肯郡 满二 3房电梯高层自住精装 屏东象峰小,189.5,20659,三盛国际公园贝肯郡,晋安,3,91.73,南,2015,"['南', '满二年', '近地铁']"
急售! 新店万科旁 旭辉榕宸天著 等证过户 毛坯3房,140,15605,旭辉榕宸天著,晋安,3,89.72,南,2021,"['南', '有电梯', '次新房']"
湖滨， ，框架，地铁口，端头，南北通透，3楼，性价比高。,268,29529,西城公寓,鼓楼,3,90.76,西南,2000,"['西南', '热门小区', '近地铁', '南北通透']"
降价30万地铁二号线新榕金城湾电梯高层装修大2房,215,22778,新榕金城湾,仓山,2,94.39,南,2018,"['南', '有电梯', '近地铁', '次新房']"
螺洲新城(三区) 产权清晰 南北通透 高层三居 近地铁,110,12223,螺洲新城(三区),仓山,3,90,南北,2018,"['南北', '满二年', '近地铁', '次新房']"
金闽小，金山中，电梯高层无遮挡，世欧彼岸城C区，刚需三房户型,290,29772,世欧彼岸城C区,仓山,3,97.41,南北,2010,"['南北', '满五年', '近地铁', '车位充足']"
二环边上，框架两房，东南西三面采光，中间楼层，南北通透,180,27693,武夷春晓,鼓楼,2,65,东西,2005,"['东西', '满五年', '近地铁', '车位充足']"
软件园旁， 刚需三房 前排可看江价格可沟通,95,10556,永丰佳园,鼓楼,3,90,南北,2017,"['南北', '满二年', '近地铁', '多人关注']"
阳光城一期，顶楼复式，一梯两户，电梯小洋房，南北通透，采光好,680,49276,阳光城一区,鼓楼,3,138,南北,2002,"['南北', '满二年', '近地铁']"
宝龙商圈地铁口 4个阳台户型媲美4带住宅 端头板状电梯商品房,530,31177,中庚书香大第北区,台江,4,170,南北,2009,"['南北', '近地铁']"
世茂三期 121平 居家4房 单价1.1万 满二,139,11489,世茂上游墅(东区),闽侯,4,120.99,南北,1980,"['南北', '热门小区', '价格优惠', '随时可看']"
橡树湾沿江楼栋出售，业主装修自己住的，保持新，房东诚意卖，周,185,21727,橡树湾橡府,仓山,3,85.15,南,2014,"['南', '满二年', '近地铁']"
哇晒 大润发周边 亏损十几万 长乐紫金轩 端头3房户型,208,16911,长乐名城紫金轩,长乐,3,123,南北,2000,"['南北', '有电梯', '车位充足']"
金辉优步东方 正南朝向 次新小区 有电梯 医疗配套成熟,72,9000,金辉优步东方,福清,2,80,南,2022,"['南', '有电梯', '次新房']"
单价1.8万！高层端头，南北通透三房，看旗山湖，二次装修,168,18864,中海寰宇天下,闽侯,3,89.06,南北,2019,"['南北', '满二年', '近地铁', '次新房']"
复式端头户型 进修边泰禾红誉一期 带两个电梯口产权车位 精装,310,22303,泰禾红誉一期,长乐,5,139,南北,2017,"['南北', '满五年', '近地铁']"
滨海新城 罗荣苑 81平温馨小3居 房东自住精装 设备全留,43.5,5404,罗荣苑,罗源,3,80.5,南北,2015,"['南北', '满二年']"
中层看江三房，自住装修，价格可谈，紧凑户型，无遮挡视野。,175,20088,中海寰宇天下,闽侯,3,87.12,南,2016,"['南', '满二年', '近地铁']"
房东装修20万，目前正在装修，22年次新社区人车分流高端社区,240,24727,大名城紫金九号,仓山,3,97.06,南,2022,"['南', '有电梯', '近地铁', '车位充足']"
地铁4号沿线，茶园山，杨桥中，贴砖3房，洪腾新村，全明户型。,258,31141,洪腾新村,鼓楼,3,82.85,南北,2003,"['南北', '满五年', '近地铁', '车位充足']"
新出 罕见 户型，标准3房2阳，正对中心花园，中间楼层,241,24100,五凤兰庭一期,鼓楼,3,100,南北,2004,"['南北', '满五年']"
杨桥路2018年小区，298w拿走，电梯3房,315,35000,陆庄庭苑,鼓楼,3,90,南北,2018,"['南北', '满五年', '近地铁', '次新房']"
五四路10年电梯，省体中心旁，琴亭新苑 东南向不沿街 高层,108,18000,琴亭新苑,晋安,2,60,南北,2010,"['南北', '满五年', '近地铁']"
央企现房别墅！五城区沿江头排！花园地下室！有天有地!看房接送,128,9352,琅岐山语城,马尾,3,136.88,南北,2021,"['南北通透', '配套成熟', '优势户型']"
泰禾红树林(1期) 高楼层采光充足 精装好房 复试刚需小三居,170,20088,泰禾红树林(1期),仓山,3,84.63,南北,2013,"['南北', '满五年', '车位充足', '多人关注']"
仓山万达爱情海旁，大乐购对面钱隆金山电梯中高层三房，装修清楚,219,23951,福晟钱隆金山,仓山,3,91.44,南北,2010,"['南北', '满二年', '近地铁']"
省体北门正对面！融侨品质！精装三房！诚意售出价谈！,245,26282,融侨花园2区,鼓楼,3,93.22,南北,2002,"['南北', '满五年', '近地铁']"
洋中新村 2室1厅 中装,93,16502,洋中新村,台江,2,56.36,南北,1999,"['南北', '近地铁']"
万家旁，正荣88复式楼 楼板倒好 动静分离 南北通透,122,13932,正荣悦澜湾,闽侯,3,87.57,南,2015,['南']
万科物业 精装3房 纯商品房 人车分离 拎包即住,168,20829,天空之城天玺,晋安,3,80.66,南,2020,"['南', '有电梯', '次新房', '人气热搜']"
排尾路次新社区 万科金域国际 精装修送私家露台,339,35741,万科金域国际,台江,3,94.85,东南,2022,"['东南', '有电梯', '近地铁', '次新房']"
三盛国际公园香樟里 87平 3室2厅 精装电梯 花园洋房社区,185,21047,三盛国际公园香樟里,晋安,3,87.9,南北,2017,"['南北', '满二年']"
鲁能公馆一期 南向采光好 商品房 有电梯 楼龄新 交通便利,280,24803,鲁能公馆一期,晋安,3,112.89,西南,2018,"['西南', '有电梯', '近地铁', '次新房']"
全小区总价低 一套看房电话联系 看房方便 有钥匙.,107,17834,长乐名城紫金轩,长乐,2,60,南北,2020,"['南北', '有电梯', '车位充足']"
鼓楼区 白马北路小柳小 精装框架2房 南北通透 西洋地铁口,143,22000,斗池新村B区,鼓楼,2,65,南北,1998,"['南北', '满五年', '近地铁', '多人关注']"
九凤花园 复古美式风格大四房便宜卖,90,7500,九凤花园,闽侯,4,120,南,2017,"['南', '满二年']"
前锦新城二期 3室2厅 两卫，居家三房两卫，,108,11786,前锦新城2区西部,仓山,3,91.64,西南,2010,"['西南', '满二年', '近地铁', '多人关注']"
阳光城新界 四室两厅两卫 低总价 地铁旁,263,23821,阳光城新界,仓山,4,110.41,南北,2013,"['南北', '近地铁']"
东端头落地一楼，带百平院子，全新装修未入住，可建阳光房,230,20721,中海寰宇天下,闽侯,3,111,南,2016,"['南', '满二年', '近地铁', '多人关注']"
新榕金城湾141.36平328万3室2厅2卫,328,23204,新榕金城湾,仓山,3,141.36,南北,2015,"['南北', '满二年', '近地铁']"
东二环泰禾 4号地铁口 有证 送车位 边套 三面采光,220,24469,蓝光星珀,晋安,3,89.91,南,2022,"['南', '有电梯', '近地铁', '次新房']"
万达对面 海润社区 电梯商品房 大三房 满两年,271,22988,海润尊品,仓山,3,117.89,南北,2010,"['南北', '满二年', '近地铁']"
精装修中段楼层地铁口商品房,165,21910,天空之城,晋安,3,75.31,南,2018,"['南', '有电梯', '近地铁', '次新房']"
三叉街 纯商社区 电梯高层 大三房 带入户花园 性价比很OK,248,24709,金辉伯爵山,仓山,3,100.37,南北,2009,"['南北', '满二年', '近地铁']"
苏宁万象宝龙商圈，04年社区精装4居自添软装可入住，满2省税,199,24174,荷花新村,台江,4,82.32,南北,2004,"['南北', '房东直卖', '满二年', '近地铁']"
晋安 东泰禾附近 温泉公园旁 塔头路 中海锦园 正规两房出售,217,29504,中海锦园,晋安,2,73.55,南北,2021,"['南北', '随时可看']"
奥体公馆 刚需小三居 正规商品房 双卫生间 近地铁 近医院,210,21935,奥体公馆,仓山,3,95.74,南,2013,"['南', 'VIP房东直卖', '满二年', '近地铁']"
蓝山四季，电梯高层，地铁口3房2卫，不沿街路，近永辉沃尔玛,225,20033,蓝山四季,晋安,3,112.32,南北,2006,"['南北', '满二年', '近地铁']"
万科金域国际 2室2厅 东南，靠近台江步行街，在排位路，有钥,170,22568,万科金域国际,台江,2,75.33,东南,2022,"['东南', '有电梯', '近地铁', '次新房']"
大人物标配 大卫城 独梯独户 入户20平 复试四房 质感精装,507,38360,融信大卫城B区,仓山,4,132.17,南北,2010,"['南北', '有电梯', '近地铁']"
21年新社区电梯房 朝南 3室 前锦新苑 诚心出售 价格可议,95,10440,前锦新苑,仓山,3,91,东南,2021,"['东南', '热门小区', '近地铁', '价格优惠']"
学生街繁华地段.施程小 .电梯刚需三房.拎包入住.送车位,213,22660,鸿城小区2期,仓山,3,94,南北,2004,"['南北', '满二年', '近地铁']"
新出霞镜3房，精装修，证已办，高楼层采光好，仓山万达奥体中心,155,19375,霞镜新城三区,仓山,3,80,南北,2019,"['南北', '满二年', '近地铁', '次新房']"
双卫格局 刚需小三居 满二 带电梯 正规商品房,129,12404,碧桂园华榕世纪城,福清,3,104,南,2019,"['南', '满二年', '次新房']"
降价20万 三盛中央公园 精装两房 电梯高层 12平大阳台,179,21953,三盛中央公园西区,晋安,2,81.54,南,2015,"['南', '满二年', '近地铁']"
阳光城西海岸B区 4室2厅,178,14221,阳光城西海岸,闽侯,4,125.17,南北,2014,"['南北', '满二年']"
王庄 购物方便 临地铁 精装修 中间楼层采光好,208,23112,世欧王庄四区,晋安,3,90,南北,2014,"['南北', '近地铁']"
双地铁，门口沃尔玛，新区小格致中，时代美景，电梯精装3房,230,20759,时代美景,晋安,3,110.8,南北,2004,"['南北', '满二年', '近地铁']"
文化宫旁省人民医院对面双杭城澜园平层三房南北通透双阳台采光好,215,24432,融信双杭城别院,台江,3,88,南北,2022,"['南北', '有电梯', '近地铁', '次新房']"
！单价7777，来电送家电 房源不限，可选好楼层，有看江,80.5,9045,中铁江湾悦城,闽侯,3,89,南北,2021,"['热门小区', '南北通透', '公摊小']"
降价 中联名城 性价比高 电梯房 双卫 精装可拎包入住,178,14976,中联名城一区,福清,3,118.86,南北,2017,"['热门小区', '南北通透', '优势户型']"
果岭生活(AB区) 环境优美 正南朝向 交通便捷 临地铁,239,20604,果岭生活(AB区),晋安,3,116,南,2006,"['南', '近地铁', '绿化率高']"
南北通透 近地铁 双卫 带产权车位 满五 高楼层采光充足,160,10888,融信上江城,长乐,4,146.96,南北,2000,"['热门小区', '南北通透', '价格优惠']"
连潘精装三房 二环内 刚需 看房方便,168,23942,长福家园,晋安,3,70.17,南北,2003,"['南北', '近地铁']"
低总价框架3房 湖滨小 不过街，南北通透一梯两户，小区改造,218,25648,西洪路180号新村,鼓楼,3,85,南北,1998,"['南北', '满二年', '近地铁']"
双卫生间 交通便利 近地铁 近医院 满五 带电梯,349,33239,衣锦华庭,鼓楼,3,105,西北,2012,"['西北', '满五年', '近地铁']"
