标题,总价（万）,单价,小区,区域,房间数,大小,朝向,建造时间,标签
保利香槟国际 2室1厅,230,34070,保利香槟国际,晋安,2,67.51,南,2013,"['南', '近地铁']"
国货小 福 外墙贴砖 居家3房 看房方便有钥匙,199,20948,河口小区,台江,3,95,东西,2003,"['东西', '满二年', '近地铁', '车位充足']"
三盛国际长岛区 136平纯毛坯 电梯中层 总价278万,268,19719,三盛国际公园长岛区,晋安,3,135.91,南北,2013,"['南北', '满二年', '近地铁', '绿化率高']"
三坊七巷，西湖旁，西峰十八，精装框架两房，拎包入住，采光好,198,30603,旧米仓新村,鼓楼,2,64.7,南北,1995,"['南北', '满五年', '近地铁']"
万达旁杉林悦榕公馆 精装修2室2厅 南北,229,28391,杉林悦榕公馆,仓山,2,80.66,南北,2015,"['南北', '满二年', '近地铁']"
南江滨畔.单价1.8万.高层看江.纯毛坯小户型.采光好,167,22890,三盛滨江国际,仓山,3,72.96,北,2018,"['北', '满二年', '近地铁', '次新房']"
西二环 湖滨小 ，交通便捷近地铁 近医院 三房全明,235,20797,煤矿中心医院单位宿舍,鼓楼,3,113,南北,1992,"['南北', '满二年', '近地铁']"
新！中亭街文化宫上下杭融信双杭城澜园4房 全明毛坯,285,24033,融信双杭城澜园,台江,4,118.59,南北,2020,"['南北', '有电梯', '近地铁', '次新房']"
三盛国际公园香缇时光二期 满二赠送多 3房电梯高层屏东象峰小,270,22882,三盛国际公园香缇时光二期,晋安,3,118,南北,2020,"['南北', '满二年', '近地铁', '次新房']"
中发印象外滩 交通便利 南北通透 中间好楼层 满二送装修,205,23136,中发印象外滩,仓山,3,88.61,南北,2019,"['南北', '近地铁', '次新房']"
霞镜新城豪华装修3房采光好拎包入住,198,24750,霞镜新城三区,仓山,3,80,南北,2020,"['南北', '有电梯', '近地铁', '次新房']"
天盛小区 近地铁 商业配套成熟 正南朝向 出行方便 产权清晰,330,35280,天盛小区,鼓楼,3,93.54,南,2002,"['南', '满五年', '近地铁']"
三附小全景星海湾看江精装修3房2卫 楼间距万米,349,36799,星海湾,仓山,3,94.84,南北,2020,"['南北', '满二年', '近地铁', '次新房']"
华林路，汽车单位宿舍，小区干净清爽，公摊小，三房，南北通透,190,22714,汽车城宿舍,鼓楼,3,83.65,南北,1998,"['南北', '满二年', '近地铁']"
急售！省体06年花园式社区！居家大三房！电梯高层！南北双阳台,273,22750,塞纳阳光,鼓楼,3,120,南北,2007,"['南北', '满五年']"
达明新村，社区里框架两房，采光好，南北通透，诚意出售。,160,23870,达明新村,鼓楼,2,67.03,南北,1998,"['南北', '满二年', '近地铁']"
浦上大道，融信物业，独梯独户 精装修三房，,229,25929,融信大卫城B区,仓山,3,88.32,南北,2012,"['南北', '满二年', '近地铁']"
总价149万，新店2011年纯商房，福晟品质，高层，电梯两房,149,21055,福晟钱隆御景,晋安,2,70.77,西南,2011,"['西南', '房东直卖', '满五年']"
富裕世家，双阳台，毛坯大二房！,305,33784,富裕世家,鼓楼,2,90.28,南北,2008,"['南北', '满五年', '近地铁']"
湖滨小 ，2年前精装3房，不用担心甲醛，西洪路湖畔小区,268,30455,湖畔小区,鼓楼,3,88,南北,1998,"['南北', '满二年', '近地铁', '车位充足']"
精装可拎包入住 近医院 满五 商业配套成熟 刚需小三居,200,21890,市直湖前小区,鼓楼,3,91.37,南北,1998,"['南北', '满五年']"
新！鼓楼省体中心，免接送钱塘屏北，3房框架结构，拎包住好停车,188,24103,福日小区,鼓楼,3,78,南北,2000,"['南北', '满五年', '近地铁']"
南向采光好 房龄新 有电梯 产权清晰 购物方便 近地铁,290,31183,杨桥新苑,鼓楼,3,93,南,2016,"['南', '有电梯', '近地铁']"
万宝商圈，西江滨旁，低总价4房，11年社区，凤湖新城,255,20565,凤湖新城一区,鼓楼,4,124,南北,2011,"['南北', '满五年', '近地铁']"
温泉小接送准电梯 商品房 外墙贴砖 树兜地铁五四鼓实屏东分,295,32379,鸿裕温泉花园,鼓楼,3,91.11,南北,2002,"['南北', '满二年', '近地铁']"
三盛国际公园长岛区 电梯房 双卫 中间楼层 南北通透 高绿化,288,23541,三盛国际公园长岛区,晋安,3,122.34,南北,2013,"['南北', '满二年', '近地铁', '绿化率高']"
单价低，火车站，电梯大三房，南北通透的,220,20755,茶园新苑,晋安,3,106,南北,2018,"['南北', '有电梯', '近地铁', '次新房']"
丽景天成，二号线地铁社区，四附。电梯一梯两户大三房，毛坯,306,23153,丽景天成1期,仓山,3,132.17,南北,2008,"['南北', '满五年', '近地铁']"
三叉街地铁口 大三房 纯毛坯 端头户型 南北通透 电梯高层,245,22898,东升新城一区,仓山,3,107,南,2018,"['南', '有电梯', '近地铁', '次新房']"
时代美景 近地铁 双卫格局 配套齐全 电梯房 中间楼层,199,21900,时代美景,晋安,3,90.87,南北,2006,"['南北', '满五年', '近地铁']"
急急急 价格可谈，南二环国企精装现房 购房送车位 端头大三房,195,20923,国贸凤凰原,仓山,3,93.2,南北,2021,"['南北', '有电梯', '近地铁', '车位充足']"
省直机关住宅区，湖前小，屏东中屏北分校，东南户型，采光视野佳,190,20680,省直机关湖前住宅区,鼓楼,3,91.88,东南,1999,"['东南', '满五年']"
东二环，次新房，公园左岸，户型方正，南北通透，采光好,350.8,33145,公园左岸,晋安,3,105.84,南北,2020,"['南北', '满二年', '近地铁', '次新房']"
新出好房三附小低总价小两房，看房方便有钥匙,190,31667,金山桔园龙苑(C区),仓山,2,60,东南,2006,"['东南', '满二年', '近地铁']"
毛坯3房，采光好，中间楼层，2018新房,215,23889,茶园新苑,晋安,3,90,南北,2018,"['南北', '满二年', '近地铁', '次新房']"
一梯两户，南北通透，电梯高层，视野好，看中心花园,335,37922,华林御景(鼓楼),鼓楼,3,88.34,东南,1997,"['东南', '满二年', '近地铁', '车位充足']"
电梯高层朝南户型结构方正正对中心花园,180,20212,融侨悦江南,仓山,3,89.06,南北,2020,"['南北', '满二年', '近地铁']"
急急急！一切都可谈 施程 滨海嘉年华D区 电梯中层,210,23184,嘉年华花园,仓山,3,90.58,南北,2010,"['南北', '有电梯', '近地铁']"
中山 十九 框架3房 精装 新外观 地铁近 采光好,289,31278,湖东新村,鼓楼,3,92.4,南北,1998,"['南北', '满二年', '近地铁', '车位充足']"
新报！接送鼓实校 屏东中 花园社区 金冠花园 3室2厅2卫,333,30337,金冠花园,鼓楼,3,109.77,南北,2003,"['南北', '满五年', '近地铁']"
中海住宅2700多户，这个带露台只有6套，很少的产品阳光棒,188,21124,中海寰宇天下,闽侯,3,89,南北,2017,"['南北', '满二年', '近地铁']"
宝龙旁 宁化小 对面 新红旗新村框架精装南北三房 拎包入住,188,22651,红旗新村,台江,3,83,南北,1999,"['南北', '满二年', '近地铁']"
鼓楼梅峰，06年贴装社区，电梯中层，户型端正，大儒世家花园。,228,24517,大儒世家花园,鼓楼,2,93,南北,2006,"['南北', '满五年']"
钱隆世家 3室2厅 南北 居家装 送露台,199,20582,钱隆世家,晋安,3,96.69,南北,2006,"['南北', '满五年', '近地铁']"
省人民旁 刚需电梯高层改善三房 南北通透 视野无遮挡,220,21783,文景苑,台江,3,101,南北,2009,"['南北', '满二年', '近地铁']"
89平端头中海寰宇天下，南北通透 户型急卖,180,20198,中海寰宇天下,闽侯,3,89.12,南北,2017,"['南北', '满二年', '近地铁']"
世茂云境 交通便捷 次新小区 双卫 高层 三房 南北通透,210,20206,世茂云境,仓山,3,103.93,南北,2020,"['南北', '满二年', '近地铁', '次新房']"
融信高层复式，产权满二，使用130平方，业主亏本处理！,215,24494,融信澜天,晋安,4,87.78,南,2021,"['南', '满二年', '次新房']"
多套则徐小！看全景三坊七巷 仓前街新村 框架大两房,239,31169,仓前街新村,鼓楼,2,76.68,南,1999,"['南', '房东直卖', '满二年', '近地铁']"
东街口，津泰路上，花园小11中，居家大2房，中间楼层，拎包住,165,23572,区委宿舍(鼓楼),鼓楼,2,70,南北,1986,"['南北', '满五年', '近地铁']"
金辉淮安国际住区泊宫江景房，纯毛坯，可随意设计,219,21534,金辉淮安国际住区泊宫,仓山,3,101.7,南北,2016,"['南北', '满二年']"
二号线地铁口 次新盘社区 电梯高层 采光无遮挡,280,32472,世茂璀璨天城(一期),晋安,3,86.23,南北,2019,"['南北', '满二年', '近地铁', '车位充足']"
电梯小高层 精装修三房 世茂璀璨天城 两层复式楼 视野采光,298,34539,世茂璀璨天城(一期),晋安,3,86.28,南,2019,"['南', '房东直卖', '有电梯', '近地铁']"
晋安湖，榕发观湖郡，三房两卫，可以看湖，楼栋位置号带装修,298,33856,榕发观湖郡,晋安,3,88.02,南北,2022,"['南北', '满二年', '近地铁', '车位充足']"
乌山小电梯三房，免接送，品质社区，端头户型。采光充足,360,41988,乌山园景,鼓楼,3,85.74,南北,1998,"['南北', '满二年', '近地铁']"
东二环泰禾旁 近距离地铁口 旁 融侨悦城 标准2房,235,34981,融侨悦城,晋安,2,67.18,南北,2018,"['南北', '满二年', '近地铁', '车位充足']"
电梯高层 正对社区中心水系 标准3房 现代装修保持很新,245,27271,融信大卫城B区,仓山,3,89.84,东南,2013,"['东南', '满五年', '近地铁']"
金山公园旁 融信大卫城 居家3房 电梯高层 仅售236万,236,26269,融信大卫城B区,仓山,3,89.84,南北,2013,"['南北', '满二年', '近地铁']"
奥体公馆 南北通透 医疗配套成熟 板楼 电梯房,185,20533,奥体公馆,仓山,3,90.1,南北,2016,"['南北', '满二年', '近地铁']"
毗临西湖公园，湖滨小和 ，电梯3房，采光 ，低，总价,263,31687,西洪小区,鼓楼,3,83,西南,2005,"['西南', '满五年', '近地铁']"
西洪小区，看西湖，全明户型，可做3房，湖滨小， ，西洪路,238,34000,西洪小区,鼓楼,2,70,东北,1998,"['东北', '满二年', '近地铁']"
摩卡纯商品房，大阳台，无遮挡，仓山万达爱琴海浦上大道奥体中心,180,20388,摩卡生活馆,仓山,2,88.29,南北,2008,"['南北', '满五年', '近地铁']"
急急急，送车位，精装修现房，拎包入住，五四北泰禾旁,185,20109,天空之城天玺,晋安,3,92,南北,2020,"['南北', '满二年', '次新房']"
万达旁霞镜新城全明通透大三房两卫,208,19810,霞镜新城八区,仓山,3,105,东南,2019,"['东南', '有电梯', '近地铁', '次新房']"
二环内精装三房紫阳地铁口两站鼓楼高层视野好房东诚意出售,225,25000,世欧王庄四区,晋安,3,90,南北,2015,"['南北', '唯一住房', '近地铁']"
阳光城新界，全新精装大两房，采光好视野好，房东诚意出售,225,27165,阳光城新界,仓山,3,82.83,南北,2013,"['南北', '满二年', '近地铁']"
找我再优惠拾万起！五四北精装现房！豪华泳池 绿城柳岸晓风,243,20924,绿城柳岸晓风,晋安,4,116.14,南北,2019,"['南北', '有电梯', '次新房']"
中发印象外滩 小三居 高楼层视野无遮挡 次新小区 南北通透,210,23700,中发印象外滩,仓山,3,88.61,南北,2020,"['南北', '有电梯', '近地铁', '次新房']"
新出急售 国货小 福 达道地铁口就在楼下 出行方便,210,21650,福澳花园,台江,3,97,南北,2000,"['南北', '满二年', '近地铁']"
金辉枫尚好房，南北双阳台,199,24801,金辉枫尚,仓山,2,80.24,南北,2010,"['南北', '满二年', '近地铁']"
鲁能公馆一期 有电梯 板楼 次新房 临地铁 产权清晰,239,27340,鲁能公馆一期,晋安,3,87.42,南北,2019,"['南北', '满二年', '近地铁', '次新房']"
华侨晓 五一北路福新路万科物业管理阳光城三期端头电梯全明两房,275,32414,阳光假日公寓,鼓楼,2,84.84,东北,2009,"['东北', '满五年', '近地铁']"
鼓五晓 五一广场古田路五 路华翔新村通透全明三房 诚心出售,245,22787,华翔新村,鼓楼,3,107.52,南北,1999,"['南北', '满五年', '近地铁']"
奥体地铁旁 华润橡树湾家园 精装端头三房看江,265,20556,华润橡树湾,仓山,3,128.92,南,2012,"['南', '满二年']"
铜盘小近左海公园，09年凤仪家园2房，南北通透 送阁楼带露台,158,20850,凤仪家园,鼓楼,2,75.78,南北,2011,"['南北', '房东直卖', '满二年', '多人关注']"
中海89平端头南北通透，整个小区就是3套拿出来卖！急卖,182,20436,中海寰宇天下,闽侯,3,89.06,南北,2017,"['南北', '满二年', '近地铁']"
真实在售）金山西桥头堡 禹洲郎庭湾 通透三房两卫 近地铁,195,22044,禹洲朗廷湾,闽侯,3,88.46,南,2020,"['南', '满二年', '近地铁', '车位充足']"
融信双杭城朗庭三期（朗庭别院） 3室1厅 毛坯,269,30355,融信双杭城别院,台江,3,88.62,南北,2021,"['南北', '有电梯', '近地铁', '次新房']"
奥体中心 近医院 有电梯 商圈成熟 临地铁 配套齐全,175,20802,奥体公馆,仓山,3,84.13,南北,2015,"['南北', '满二年', '近地铁']"
新到！单位宿舍！单价3.1万，北江新村，端头户型。看房随时！,280,34568,外贸基地宿舍,鼓楼,2,81,南北,1995,"['南北', '满五年', '近地铁']"
钱塘小，大三房，单位小区，户型方正,315,33281,龙腰干休所,鼓楼,3,94.65,南北,1990,"['南北', '满二年', '近地铁']"
五四路省体中心，99年马塞克，琴亭花园端头3房 中层采光好,215,24713,琴亭花园,鼓楼,3,87,南北,1999,"['南北', '近地铁']"
茶亭地铁口 交通路 框架3房 板状南北通透 适中楼层 急售!,195,21667,遥逸居,台江,3,90,南北,2001,"['南北', '满五年', '近地铁', '车位充足']"
万宝商圈2015年人车分流社区 精装东南北全明3房 双阳台,230,24855,福机新苑,台江,3,92.54,南北,2015,"['南北', '满五年', '近地铁']"
自住装修 性价比高 价格还可沟通 南北双阳台 独梯独户,292,21506,三盛国际公园长岛区,晋安,3,135.78,南北,2013,"['南北', '满二年', '近地铁', '绿化率高']"
融信 B区，标准大三房，高楼层可看江，视野非常好,280,23665,融信白宫,仓山,3,118.32,西南,2013,"['西南', '满二年', '近地铁']"
首山新都汇100.0平320万3室2厅1卫,320,32000,首山新都汇,仓山,3,100,南北,2015,"['南北', '满二年', '近地铁']"
有证！国贸凤凰原商品房 开发商精装交付 看房方便,180,20356,国贸凤凰原,仓山,3,88.43,南北,2022,"['南北', '有电梯', '近地铁', '车位充足']"
金建小区三期2室2厅1卫，采光很好，没有遮挡,155,20444,金建小区三期,仓山,2,75.82,南,2010,"['南', '房东直卖', '有电梯', '近地铁']"
万达旁金建三期高层端头全明户型 视野宽阔 性价比高,218,20762,金建小区三期,仓山,3,105,南北,2019,"['南北', '满二年', '近地铁', '次新房']"
五四北 房龄新 高楼层采光充足 带电梯 商品住宅 小区绿化高,215,23889,三盛国际公园剑桥区,晋安,2,90,南,2015,"['南', '满二年', '绿化率高']"
价格空间巨大！2房朝南双卫精装自住！达道市1医院|维也纳C区,220,25175,金色维也纳C区,台江,2,87.39,南北,2003,"['南北', '近地铁']"
国货小 广达花园 居家大三房 南北通透 双阳台户型,245,22906,广达花园,台江,3,106.96,南北,2002,"['南北', '满二年', '近地铁']"
金闽小大三房，南北通透，低总价，地铁金山站，榕心印月旁。,183,24079,金闽小区二区东区,仓山,3,76,南北,2000,"['南北', '满二年', '近地铁']"
鲁能公馆一期 楼龄新 朝南 商品住宅 中间楼层 双卫,350,31498,鲁能公馆一期,晋安,3,111.12,南,2017,"['南', '有电梯', '近地铁']"
万达旁豪装洋房三层使用丨买一层送2层 适合大家庭,345,23984,融晟红郡,仓山,6,143.85,南北,2012,"['南北', '满五年', '近地铁']"
温泉小，馨泉公寓，商品房，框架大三房，小区贴砖，楼层好,310,33696,馨泉公寓,鼓楼,3,92,南北,1998,"['南北', '满五年', '近地铁']"
电梯高层视野开阔，次新房,283,33162,世茂璀璨天城(一期),晋安,3,85.34,南北,2018,"['南北', '满二年', '近地铁', '车位充足']"
sm广场旁 房东资金周转 血亏装修款转手！ 近1号线地铁！,180,20225,大东海中央府C区,仓山,3,89,南北,2020,"['南北', '满二年', '近地铁', '次新房']"
多套在卖 中海寰宇天下高层出售，视野宽广，急售 地铁口,231,21362,中海寰宇天下,闽侯,3,108.14,南,2016,"['南', '有电梯', '近地铁']"
（电建二公司南苑居家精装三房 ）华林路 斗门地铁口 省体茶园,162,20622,电建二公司南院生活区,晋安,3,78.56,南北,1999,"['南北', '满二年', '近地铁']"
降价，华侨小11中，通透大4房，近水部地铁口，好楼层，采光赞,308,24640,玉融花园,鼓楼,4,125,南北,2003,"['南北', '满二年', '近地铁']"
象园小旁，单位小区管理，电梯3房，客厅带采光。,250,22972,惠能花园3-8号楼,晋安,3,108.83,南北,1999,"['南北', 'VIP房东直卖', '有电梯', '近地铁']"
工业路，博美诗邦复式楼群升白马郡旁文化宫宝龙城市广场书香大第,278,33547,融信双杭城朗庭一期,台江,3,82.87,南北,2021,"['南北', '唯一住房', '近地铁', '车位充足']"
人车分流，地铁，霞镜新城，全明3房，低总价， ，通透,190,21112,霞镜新城六区,仓山,3,90,南北,2018,"['南北', '有电梯', '近地铁', '次新房']"
刚需好房，华威时代做陪，电梯中高层，精装基本为住。满二,195,22912,奥体公馆,仓山,3,85.11,南北,2015,"['南北', '满二年', '近地铁']"
上渡新苑三区 3室2厅 上渡新社区电梯 置换好社区,220,21360,上渡新苑三区,仓山,3,103,东,2019,"['东', '有电梯', '次新房']"
福晟钱隆御景 东南户型 有电梯 满二 医疗配套成熟,245,23663,福晟钱隆御景,晋安,3,103.54,东南,2011,"['东南', '满二年']"
鼓楼左海，08园林社区，精装三房，南北通透，鼓楼庭院。,238,20788,鼓楼庭院,鼓楼,3,114.49,南北,2008,"['南北', '满五年']"
中庚城三期，电梯高层全景万科里，精装修50万,363,31026,中庚城三期上峰,仓山,3,117,南北,2015,"['南北', '满二年', '近地铁']"
近地铁 居家三房朝南，大入户拎包入住,248,22106,融信三味舒屋,仓山,3,112.19,南北,2007,"['南北', '满五年', '近地铁']"
满二 南北通透 3室2厅 精装修,185,20857,博仕后官邸,闽侯,3,88.7,南北,2015,"['南北', '满二年', '近地铁']"
新出，二环旁国企现房，不看三件套视野好，南北通透全明户型，,211,24090,水晶榕著,仓山,3,87.59,南北,2021,"['南北', '满二年', '车位充足']"
金山公园 地铁二号线别墅社区美林湾 三室两厅,280,21828,美林湾(东区),仓山,3,128.28,南,2007,"['南', '满五年', '近地铁', '车位充足']"
奥体中心！南二环丨房主狂甩高品质丨好房精装修丨奥体金茂悦,195,22773,奥体金茂悦,仓山,3,85.63,南北,2020,"['南北', '满二年', '次新房']"
给您一个家奥体金茂悦，超值 好房子,199,23148,奥体金茂悦,仓山,3,85.97,南北,2018,"['南北', '满二年', '次新房']"
新出！鼓楼区！铁四号线300米！民水民电！烫金地段！,185,21510,华润万象城,鼓楼,2,86.01,南北,2022,"['南北', '有电梯', '近地铁', '次新房']"
230万 3室2厅 电梯房 城投鹤鸾郡 横屿路 东泰禾,230,21884,城投鹤鸾郡,晋安,3,105.1,南北,2022,"['南北', '满二年', '近地铁', '车位充足']"
六一路近地铁 接送温泉小 带6米大阳台 西端头华林路,368,31211,龙湖盛天天钜,晋安,3,117.91,南北,2022,"['南北', '有电梯', '近地铁', '次新房']"
21年人车分离安商房，金鸡山隧道，过隧道到东二环，近温泉公园,283,32204,龙湖盛天天钜,晋安,3,87.88,南,2022,"['南', '满二年', '近地铁', '次新房']"
车接车送看毛坯现房！配套成熟！找我享特惠！,186,24172,蓝光玖榕台,晋安,3,76.95,南,2021,"['南', '满二年', '近地铁', '车位充足']"
国货小福 免接送 近达道 市一医院,186,22075,红日花园,台江,3,84.26,南北,1997,"['南北', '满二年', '近地铁']"
鲁能一期离地铁近高层带小复式可做阳光房，社区新,265,32440,鲁能公馆一期,晋安,3,81.69,南北,2017,"['南北', '有电梯', '近地铁']"
新！鼓一小隔壁，免接送！大三房，西湖屏山地铁口,350,38206,国土厅宿舍小区,鼓楼,3,91.61,南北,1992,"['南北', '满二年', '近地铁']"
井大小，光复新村，110平，框架大三房，电梯中层，东端头,335,32415,光复新村,鼓楼,3,103.35,南北,1998,"['南北', '满五年', '近地铁']"
新大陆，精致三房，高楼层，好江景，好价格，赞赞赞,179.5,20447,新大陆壹号,马尾,3,87.79,南北,2015,"['南北', '唯一住房']"
好楼层，房东诚意，方便看房，兴价比高,235,20797,福明苑,台江,3,113,西北,1993,"['西北', '满二年', '近地铁', '车位充足']"
白马河纯商社区，市中心洋房！端头户型，适合改善接送，外墙贴砖,360,33880,翠园公寓,鼓楼,3,106.26,南,2005,"['南', '满五年', '近地铁']"
豪华装修，带大露台，房东自己住婚房,248,33973,卧湖新苑,鼓楼,3,73,南北,1997,"['南北', '房东直卖', '满二年', '近地铁']"
近东街口，接送鼓一04年花园小区，框架三房楼层好，停车方便！,288,34850,锦绣华庭,鼓楼,3,82.64,南北,2003,"['南北', '满二年', '近地铁']"
金闽小区二期，电梯房，精装，地铁口。金闽小金山中。看房提前,298,21912,金闽小区二期,仓山,3,136,南北,2010,"['南北', '满五年', '近地铁']"
香江枫景120.14平370万3室2厅2卫,370,30798,香江枫景,仓山,3,120.14,南,2008,"['南', '房东直卖', '满五年', '近地铁']"
"香江枫景,南北通透大两房，采光好，视野开阔，房间都很大",259,32898,香江枫景,仓山,2,78.73,南北,2006,"['南北', '满二年', '近地铁']"
整个中海89平端头南北通透就3套在卖，少有产品在售！！！,180,20212,中海寰宇天下,闽侯,3,89.06,南北,2017,"['南北', '满二年', '近地铁']"
金山新房 龙湖兰园天序 2室2厅 ，看房随时,165,22449,龙湖兰园天序,仓山,2,73.5,南北,2022,"['南北', '有电梯', '近地铁', '次新房']"
前横路门口地铁口，现房，好楼层南北通透 一步晋安湖,210,23721,蓝光星珀,晋安,3,88.53,南北,2020,"['南北', '有电梯', '近地铁', '次新房']"
鼓楼左海铜盘，左海公寓，居家三房，南北通透，不沿街，中层,200,24097,左海公寓(东区),鼓楼,3,83,南北,1998,"['南北', '满五年']"
仓小，三叉街地铁口，老仓山生活交通便利,255,23288,龙登天锦,仓山,3,109.5,南北,2005,"['南北', '满二年', '近地铁']"
华润橡树湾丨一线全江景丨狠急售293万丨价格空间大丨诚意出售,293,21116,华润橡树湾,仓山,3,138.76,南北,2015,"['南北', '房东直卖', '满五年']"
优选 六一北路主干道 晋安花园 温泉公园东侧 好楼层性价比高,170,17526,晋安花园,晋安,3,97,南北,2000,"['南北', '满二年', '近地铁']"
地铁东街口，可做框架3房，全明户型，精装修，达明小,229,32082,肃威花园,鼓楼,3,71.38,东西,2000,"['东西', '满二年', '近地铁']"
急售！电信宿舍，茶园山小，杨桥中，电梯3房，南北通透，杨桥路,327,31143,蓝天电信宿舍,鼓楼,3,105,南北,2000,"['南北', '房东直卖', '满五年', '近地铁']"
新店五四北万科物业南北通透琴亭湖鲁能建发,339,37192,万科金域榕郡,晋安,3,91.15,南北,2012,"['南北', '满二年']"
国货小福 电梯板状一梯两户 3房 南北通透 采光好,195,20419,广安城,台江,3,95.5,南北,2000,"['南北', '满五年', '近地铁']"
岳峰新城三区 装修好 交通便利 配套成熟 近地铁 双卫,310,22963,岳峰新城三区,晋安,4,135,南北,2017,"['南北', '满二年', '近地铁']"
晋安 东二环 鹤林新城 三房 电梯高层全明采光,208,20662,鹤林新城,晋安,3,100.67,西南,2008,"['西南', '满二年', '近地铁']"
拆迁房源小柳小河南新村地块急售多个对比可以按揭贷款,166,20494,小柳新村,鼓楼,2,81,南北,1990,"['南北', '近地铁']"
万达 品质社区 电梯大三房,279,24860,正祥一品新筑,仓山,3,112.23,南北,2008,"['南北', '满五年', '近地铁']"
五四路 屏东路 中山十九 2023年新小区 书香红墙,390,37143,书香红墙,鼓楼,3,105,南北,2023,"['南北', '唯一住房', '近地铁', '次新房']"
中联御景湾 正规商品房 次新房 交通便捷 临地铁 电梯房,159,22637,中联御景湾,仓山,2,70.24,西南,2020,"['西南', '满二年', '近地铁', '次新房']"
高桥阳光新村 3室2厅 简装,210,21000,高桥阳光新村,台江,3,100,南北,2001,"['南北', '近地铁', '车位充足']"
温泉小， ，框架三房朝南，闹中取静，低总价，免接送,306,35657,怡泉花园,鼓楼,3,85.82,南北,1998,"['南北', '满二年', '近地铁', '车位充足']"
急售!茶园山小，杨桥中，框架3房，福大教师楼，全明户型,183,23283,怡园,鼓楼,3,78.6,南北,1999,"['南北', '满五年', '近地铁']"
仓小万春二区三房上藤地铁口业主急售,265,33125,万春二区,仓山,3,80,南,1998,"['南', '满五年', '近地铁']"
